{
  "$schema": "../../schemas/constraint.schema.json",
  "schema": "decision-archaeology.constraint@v0",
  "id": "CC-0010",
  "type": "INCONCLUSIVE",
  "claim": "A public web archive already retains observations of this repository's load-bearing revisions.",
  "tags": [
    "external-pin",
    "retention",
    "witness"
  ],
  "environment": {
    "what": "web.archive.org availability API against GitHub commit pages",
    "versions": [
      "checked 2026-08-22"
    ],
    "assumptions": [
      "read-only query; nothing was submitted for capture"
    ]
  },
  "applies_until": "Someone captures the commit pages, or a different kind of witness is adopted. This says nothing about whether such a witness is a good idea.",
  "cost": {
    "to_discover": "two API calls",
    "to_recheck": "two API calls"
  },
  "authority": "records-only"
}
